<?xml version="1.0" encoding="UTF-8"?>

<!ELEMENT books (konyv*)>
<!ELEMENT book (title, published, publisher, author+, absztrakt?)>
<!ATTLIST book id ID #REQUIRED>
<!ELEMENT title (#PCDATA)>
<!ELEMENT published (#PCDATA)>
<!ELEMENT publisher (#PCDATA)>
<!ELEMENT author (#PCDATA)>
<!ELEMENT abstract (#PCDATA)>